PMID	Title	Abstract	Keywords	Journal	Institution	Country	Year	DOI
23715853	Cleavage and synthesis function of high and low redox potential laccases towards 4-morpholinoaniline and amited as well as chlorited phenols	Laccases are able to mediate both cleavage and synthesis processes. The basis for this dual reaction capability lies in the property of the enzyme laccase to oxidize phenolic, and to some extent non-phenolic substances, to reactive radicals which can undergo on the one hand separations of small substitutents or large molecule parts from the parent compound and on the other hand coupling reactions with other radicals or molecules which are not themselves oxidizable by laccase. The cleavage of the non-phenolic compound 4-morpholinoaniline as well as the deamition of 4-aminophenol and the dechlorition of 4-chlorophenol resulted in the formation of 1,4-hydroquinone which is immediately oxidized by laccase to 1,4-benzoquinone. The formation of the 1,4-hydroquinone/1,4-benzoquinone is the rate limiting step for the synthesis of the heteromolecular dimers and trimers composed of 1,4-benzoquinone and one or two molecules of morpholine. In addition to the synthesis of new compounds from the cleavage products, 4-morpholinoaniline polymerized probably via azo groups and C-N bonds to a homomolecular dimer and trimer. Similarities and differences in cleavage and synthesis reactions catalyzed by the low redox potential laccase of Myceliophthora thermophila (0.46 V) and the high redox potential laccase of Pycnoporus cinbarinus (0.79 V) were determined. In addition, the dependency of the cleavage and synthesis efficiencies on the (a) structure and redox potential of the laccase, (b) structure and redox potential of the substrate, (c) pH value of the buffer used, (d) incubation temperature, (e) solvent concentration, and (f) laccase activity is discussed in general.		Applied microbiology and biotechnology	Institute of Microbiology, Ernst-Moritz-Arndt-University of Greifswald, Friedrich-Ludwig-Jahn Strasse 15, 17487, Greifswald, Germany, veronikahahn@gmx.at.		2014	10.1007/s00253-013-4984-9
23795296	Scaffold nucleoporins Nup188 and Nup192 share structural and functiol properties with nuclear transport receptors	Nucleocytoplasmic transport is mediated by nuclear pore complexes (NPCs) embedded in the nuclear envelope. About 30 different proteins (nucleoporins, nups) arrange around a central eightfold rotatiol axis to build the modular NPC. Nup188 and Nup192 are related and evolutiory conserved, large nucleoporins that are part of the NPC scaffold. Here we determine the structure of Nup188. The protein folds into an extended stack of helices where an N-termil 130 kDa segment forms an intricate closed ring, while the C-termil region is a more regular, superhelical structure. Overall, the structure has distant similarity with flexible S-shaped nuclear transport receptors (NTRs). Intriguingly, like NTRs, both Nup188 and Nup192 specifically bind FG-repeats and are able to translocate through NPCs by facilitated diffusion. This blurs the existing dogma of a clear distinction between statiory nups and soluble NTRs and suggests an evolutiory relationship between the NPC and the soluble nuclear transport machinery. DOI:http://dx.doi.org/10.7554/eLife.00745.001.	Myceliophthora thermophila, S. cerevisiae, macromolecular assemblages, nucleocytoplasmic transport	eLife	Department of Biology , Massachusetts Institute of Technology , Cambridge , United States.	United states	2013	10.7554/eLife.00745
23911459	The influence of the primary and secondary xanthan structure on the enzymatic hydrolysis of the xanthan backbone	Differently modified xanthans, varying in degree of acetylation and/or pyruvylation were incubated with the experimental cellulase mixture C1-G1 from Myceliophthora thermophila C1. The ionic strength and/or temperature of the xanthan solutions were varied, to obtain different xanthan conformations. The exact conformation at the selected incubation conditions was determined by circular dichroism. The xanthan degradation was alyzed by size exclusion chromatography. It was shown that at a fixed xanthan conformation, the backbone degradation by cellulases is equal for each type of xanthan. Complete backbone degradation is only obtained at a fully disordered conformation, indicating that only the secondary xanthan structure influences the fil degree of hydrolysis by cellulases. It is thereby shown that, independently on the degree of substitution, xanthan can be completely hydrolyzed to oligosaccharides. These oligosaccharides can be used to further investigate the primary structure of different xanthans and to correlate the molecular structure to the xanthan functiolities.	Cellulases, Circular dichroism, Conformation, Degree of substitution, HPSEC, Retured xanthan	Carbohydrate polymers	Wageningen University, Laboratory of Food Chemistry, PO Box 8129, 6700 EV Wageningen, The Netherlands.	The Netherlands	2013	10.1016/j.carbpol.2013.05.045
23683701	Two novel GH11 endo-xylases from Myceliophthora thermophila C1 act differently toward soluble and insoluble xylans	Two novel GH11 endo-xylases from Myceliophthora thermophila C1 (C1), Xyl7 and Xyl8, were purified and the influence of solubility and molecular structure of various xylans on their efficiency was investigated. Both endo-xylases were hindered by a high degree of substitution of a xylan. The two GH11 xylases released different products from the xylans, in which Xyl7 displayed a degradation product composition closer to GH10 xylases. A correlation of the degradation product composition with a specific residue at position 163 in the amino acid sequence of Xyl8 is suggested: tyrosine in Xyl8; valine in Xyl7. This is confirmed with examples of various endo-xylases reported in literature. The C1 GH11 xylases were more efficient on self-associated xylan compared to C1 GH10 endo-xylases and they released more small xylooligomers from these xylans. This is contrary to the general assumption that GH10 xylases degrade xylans to a higher degree than GH11 xylases.		Enzyme and microbial technology	Laboratory of Food Chemistry, Wageningen University, P.O. Box 8129, 6700 EV Wageningen, The Netherlands.	The Netherlands	2013	10.1016/j.enzmictec.2013.03.019
23841747	Understanding pulp delignification by laccase-mediator systems through isolation and characterization of lignin-carbohydrate complexes	The effects and mechanism of pulp delignification by laccases in the presence of redox mediators have been investigated on unbleached eucalyptus kraft pulp treated with laccases from Pycnoporus cinbarinus (PcL) and Myceliophthora thermophila (MtL) and 1-hydroxybenzotriazole (HBT) and methyl syringate (MeS) as mediators, respectively. Determition of the corrected kappa number in eucalyptus pulps after the enzymatic treatments revealed that the PcL-HBT system exhibited a more remarkable delignification effect than the MtL-MeS system. To obtain further insight, lignin-carbohydrate complexes were fractioted and subsequently characterized by nuclear magnetic resonce, thioacidolysis (followed by gas chromatography and size exclusion chromatography), and pyrolysis-gas chromatography-mass spectrometry (pyrolysis-GC-MS) alyses before and after the enzymatic treatments and their controls. We can conclude that the laccase-mediator treatments altered the lignin structures in such a way that more lignin was recovered in the xylan-lignin fractions, as shown by Klason lignin estimation, with smaller amounts of both syringyl (S) and guaiacyl (G) uncondensed units, as shown by thioacidolysis and gas chromatography, especially after the PcL-HBT treatment. The laccase-mediator treatment produced oxidation at Calpha and cleavage of Calpha and Cbeta bonds in pulp lignin, as shown by pyrolysis-GC-MS. The general mechanism of residual lignin degradation in the pulp by laccase-mediator treatments is discussed in light of the results obtained.		Biomacromolecules	Department of Fibre and Polymer Technology, Royal Institute of Technology, KTH, Teknikringen 56-58, SE-10044 Stockholm, Sweden.	Sweden	2013	10.1021/bm4006936
23218295	Obtaining biobleached eucalyptus cellulose fibres by using various enzyme combitions	Various combitions of laccases, xylase and cellulase were used to biobleach cellulose fibres from eucalyptus. The Trametes villosa and Myceliophthora thermophila laccases were used in combition with violuric acid (VA(TvL) system) and methyl syringate (MeS(MtL) system), respectively, as mediator. A dissimilar mode of action of the two systems was found: the VA(TvL) treatment released both hexenuronic acids and lignin, whereas the MeS(MtL) released lignin alone. Pulp properties were further improved by applying the mediator before the enzyme during treatment. Pulp properties comparable to those provided by industrial TCF sequences were obtained by inserting a xylase pretreatment before VA(TvL), but no significant effect was observed after the cellulase pretreatment. As an added value, the resulting enzymatically bleached fibres possess a reduced hexenuronic acid content. The chemical oxygen demand of the effluents from each stage was also assessed.		Carbohydrate polymers	Textile and Paper Engineering Department, Universitat Politecnica de Catalunya, Colom 11, E-08222 Terrassa, Spain. cristina.valls@upc.edu	Spain	2013	10.1016/j.carbpol.2012.08.083
23360704	Polymerisation of Kraft lignin from black liquors by laccase from Myceliophthora thermophila: effect of operatiol conditions and black liquor origin	The capacity of laccase from Myceliophthora thermophila to promote the oxidative polymerisation of Kraft lignin (KL) was evaluated in several conditions of pH, temperature, enzyme dosage and treatment time. Moreover, different black liquors from the Kraft cooking of Eucalyptus globulus and mixture of Pinus pister/E. globulus were evaluated in order to determine the effect of the KL source on the polymerisation reaction. Furthermore, one of these black liquors was fractioted by sequential organic solvent fractiotion and the polymerisation of the corresponding fractions was tested. Polymerisation products were alysed by size exclusion chromatography and Fourier transform infrared spectroscopy. The results provide evidence of notable lignin modifications after incubation with laccase. Structural oxidation and a notably molecular weight increase were attained, reaching a polymer of 69-fold its initial molecular weight depending on the raw lignin. Moreover, optimum values of reaction conditions were obtained: pH 7.3, 70 degrees C, 2UmL(-1) and 2h.		Bioresource technology	Department of Chemical Engineering, University of Vigo, Lagoas Marcosende s/n, E-36310 Vigo, Spain.	Spain	2013	10.1016/j.biortech.2012.12.155
23570533	Laccase-mediated coupling of nonpolar chains for the hydrophobization of lignocellulose	We investigate the use of laccase enzymes to couple short nonpolar chains containing aromatic groups onto flax fibers and nofibrillated cellulose (NFC) with different lignin contents. Trametes villosa , Pycnoporus cinbarinus , and Myceliophthora thermophila were used to facilitate surface coupling and to produce materials with different levels of hydrophobicity. Heat treatment of fiber webs after lacccase-mediated coupling markedly increased the resistance to water absorption. The highest hydrophobization levels of flax fibers was achieved by coupling dodecyl 3,4,5-trihydroxybenzoate (HB-C12), which yielded water contact angles (WCAs) of 80-96 degrees and water absorption times (drop tests) of ca. 73 min. The results from apparent aromatic content and FTIR alyses confirmed the laccase-mediated coupling of HB-C12 onto the cellulose fibers. Ultrathin films of NFC were also used as substrates for enzyme-mediated hydrophobization with HB-C12. In these cases, WCAs in the range of 87-104 degrees were achieved, depending on the conditions. Quartz crystal microgravimetry (QCM) was used to study the dymics and the extent of the coupling process onto cellulose. The results help to better understand the mechanisms involved in laccase-mediated hydrophobization and provide a proof of a biotechnological platform for the development of value-added fiber products.		Biomacromolecules	Textile and Paper Engineering Department, ETSEIAT, Universitat Politecnica de Catalunya, E-08222 Terrassa, Spain.	Spain	2013	10.1021/bm400291s
23788272	Membraneless glucose/oxygen enzymatic fuel cells using redox hydrogel films containing carbon notubes	Co-immobilisation of three separate multiple blue copper oxygeses, a Myceliophthora thermophila laccase, a Streptomyces coelicolor laccase and a Myrothecium verrucaria bilirubin oxidase, with an [Os(2,2'-bipyridine)2 (polyvinylimidazole)10Cl](+/2+) redox polymer in the presence of multi-walled carbon notubes (MWCNTs) on graphite electrodes results in enzyme electrodes that produce current densities above 0.5 mA cm(-2) for oxygen reduction at an applied potential of 0 V versus Ag/AgCl. Fully enzymatic membraneless fuel cells are assembled with the oxygen-reducing enzyme electrodes connected to glucose-oxidising anodes based on co-immobilisation of glucose oxidase or a flavin adenine dinucleotide-dependent glucose dehydrogese with an [Os(4,4'-dimethyl-2,2'-bipyridine)2(polyvinylimidazole)10Cl](+/2+) redox polymer in the presence of MWCNTs on graphite electrodes. These fuel cells can produce power densities of up to 145 muW cm(-2) on operation in pH 7.4 phosphate buffer solution at 37  degrees C containing 150 mM Cl, 5 mM glucose and 0.12 mM O2. The fuel cells based on Myceliophthora thermophila laccase enzyme electrodes produce the highest power density if combined with glucose oxidase-based anodes. Although the maximum power density of a fuel cell of glucose dehydrogese and Myceliophthora thermophila laccase enzyme electrodes decreases from 110 muW cm(-2) in buffer to 60 muW cm(-2) on testing in artificial plasma, it provides the highest power output reported to date for a fully enzymatic glucose-oxidising, oxygen-reducing fuel cell in artificial plasma.	enzyme electrodes, fuel cells, glucose oxidation, oxygen reduction, redox chemistry	Chemphyschem : a European journal of chemical physics and physical chemistry	School of Chemistry & Ryan Institute, National University of Ireland Galway, University Road, Galway, Ireland.	Ireland	2013	10.1002/cphc.201300239
23638383	Cloning, expression and characterization of an ethanol tolerant GH3 beta-glucosidase from Myceliophthora thermophila	The beta-glucosidase gene bgl3a from Myceliophthora thermophila, member of the fungal glycosyl hydrolase (GH) family 3, was cloned and expressed in Pichia pastoris. The mature beta-glucosidase gene, which results after the excision of one intron and the secreting sigl peptide, was placed under the control of the strong alcohol oxidase promoter (AOX1) in the plasmid pPICZalphaC. The recombint enzyme (90 kDa) was purified and characterized in order to evaluate its biotechnological potential. Recombint P. pastoris efficiently secreted beta-glucosidase into the medium and produced high level of enzymatic activity (41 U/ml) after 192 h of growth, under methanol induction. MtBgl3a was able to hydrolyze low molecular weight substrates and polysaccharides containing beta-glucosidic residues. The K m was found to be 0.39 mM on p-beta-NPG and 2.64 mM on cellobiose. Optimal pH and temperature for the p-beta-NPG hydrolysis were 5.0 and 70  degrees C. The beta-glucosidase exhibits a half life of 143 min at 60  degrees C. Kinetic parameters of inhibition were determined for D-glucose, D-xylose and D-gluconic acid, indicating tolerance of the enzyme for these sugars and oxidized products. The recombint enzyme was stimulated by short chain alcohols and has been shown to efficiently synthesize methyl-D-glucoside in the presence of methanol due to its transglycosylation activity. The stability of MtBgl3a in ethanol was prominent, and it retained most of its origil activity after we exposed it to 50% ethanol for 6 h. The high catalytic performance, good thermal stability and tolerance to elevated concentrations of ethanol, D-xylose and D-glucose qualify this enzyme for use in the hydrolysis of lignocellulosic biomass for biofuel production, as part of an efficient complete multi-enzyme cocktail.	Ethanol tolerance, Glycoside hydrolase family 3, Myceliophthora thermophila, Overexpression, Pichia pastoris, Thermophilic, Transglycosylation, beta-glucosidase	PeerJ	Biotechnology Laboratory, School of Chemical Engineering, National Technical University of Athens , Athens , Greece.	Greece	2013	10.7717/peerj.46
23275164	The structure of a novel glucuronoyl esterase from Myceliophthora thermophila gives new insights into its role as a potential biocatalyst	The increasing demand for the development of efficient biocatalysts is a consequence of their broad industrial applications. Typical difficulties that are encountered during their exploitation in a variety of processes are interconnected with factors such as temperature, pH, product inhibitors etc. To elimite these, research has been directed towards the identification of new enzymes that would comply with the required standards. To this end, the recently discovered glucuronoyl esterases (GEs) are an enigmatic family within the carbohydrate esterase (CE) family. Structures of the thermophilic StGE2 esterase from Myceliophthora thermophila (synonym Sporotrichum thermophile), a member of the CE15 family, and its S213A mutant were determined at 1.55 and 1.9 A resolution, respectively. The first crystal structure of the S213A mutant in complex with a substrate alogue, methyl 4-O-methyl-beta-D-glucopyranurote, was determined at 2.35 A resolution. All of the three-dimensiol protein structures have an alpha/beta-hydrolase fold with a three-layer alphabetaalpha-sandwich architecture and a Rossmann topology and comprise one molecule per asymmetric unit. These are the first crystal structures of a thermophilic GE both in an unliganded form and bound to a substrate alogue, thus unravelling the organization of the catalytic triad residues and their neighbours lining the active site. The knowledge derived offers novel insights into the key structural elements that drive the hydrolysis of glucuronic acid esters.		Acta crystallographica. Section D, Biological crystallography	Institute of Biology, Medicinal Chemistry and Biotechnology, National Hellenic Research Foundation, Athens, Greece.	Greece	2013	10.1107/S0907444912042400
23622721	Potential of autochthonous fungal strains isolated from contamited soils for degradation of polychlorited biphenyls	Up to now, most studies on polychlorited biphenyl (PCB) bioremediation have examined the ability of model fungal strains to biodegrade PCBs. Yet, there is limited information concerning the potential of autochthonous filamentous fungal strains in the biodegradation of PCBs and their possible use in the environmental technologies. In this study, we investigated the capacity of autochthonous fungal strains in the biodegradation of PCBs by isolating 24 taxa from former industrial sites highly contamited by PCBs. Microscopic and molecular alyses using the interl transcribed spacer (ITS) region revealed that the fungal strains belonged to the phyla Ascomycota (19 strains) and Zygomycota (five strains). The chromatography gas alysis revealed evidence of degradation of seven PCB congeners. With the exception of Circinella muscae which presented no degradation potential, the other fungal strains exhibited a rate of biodegradation ranging from 29 to 85 % after 7 d of incubation in liquid medium. Among these strains, Doratomyces nus, Doratomyces purpureofuscus, Doratomyces verrucisporus, Myceliophthora thermophila, Phoma eupyre, and Thermoascus crustaceus showed remarkable degradation ability (>70 %) regardless of the number of chlorine substituents on the biphenyl nucleus and a high tolerance towards PCBs. To our knowledge, this is the first study that demonstrates the ability of PCB degradation by these species and indicates the potential effectiveness of some autochthonous fungal strains in bioremediation systems.		Fungal biology	Laboratoire d'Ecologie Alpine, UMR 5553 CNRS, Universite Joseph Fourier, Grenoble 1, Grenoble Cedex 9, France. bello.mouhamadou@ujf-grenoble.fr	France	2013	10.1016/j.funbio.2013.02.004
22728192	Two GH10 endo-xylases from Myceliophthora thermophila C1 with and without cellulose binding module act differently towards soluble and insoluble xylans	Xylases are mostly classified as belonging to glycoside hydrolase (GH) family 10 and 11, which differ in catalytic properties and structures. However, within one family, differences may also be present. The influence of solubility and molecular structure of substrates towards the efficiency of two GH10 xylases from Myceliophthora thermophila C1 was investigated. The xylases differed in degradation of high and low substituted substrate and the substitution pattern was an important factor influencing their efficiency. Alkali-labile interactions, as well as the presence of cellulose within the complex cell wall structure hindered efficient hydrolysis for both xylases. The presence of a carbohydrate binding module did not enhance the degradation of the substrates. The differences in degradation could be related to the protein structure of the two xylases. The study shows that the classification of enzymes does not predict their performance towards various substrates.		Bioresource technology	Laboratory of Food Chemistry, Wageningen University, P.O. Box 8129, 6700 EV Wageningen, The Netherlands.	The Netherlands	2012	10.1016/j.biortech.2012.05.117
22858477	Enzymatic polymerisation and effect of fractiotion of dissolved lignin from Eucalyptus globulus Kraft liquor	The potential ability of the laccase from Myceliophthora thermophila, either alone or with low molecular weight (LMW) additives, to polymerise a dissolved lignin from Kraft liquor of eucalypt cooking was investigated. A previous study of enzymatic performance (activity and stability) was carried out using a design experiment methodology. In addition, Kraft dissolved lignin (KDL) was fractioted according to two different protocols (solvent extraction and acidic fractiotion) in order to identify possible lignin fractions with noticeable polymerisation ability. KDL and its corresponding lignin fractions were treated with laccase and alysed by size exclusion chromatography and Fourier transform infrared spectroscopy. The results provide conclusive evidence of notable lignin modifications after incubation with laccase. Moreover, lignin fractiotion allows to obtain lignin fractions with different chemical characteristics and polymerisation capability. Depending on the type of raw lignin, molecular weight can increase from 4- to 21-fold by means of laccase polymerisation.		Bioresource technology	Department of Chemical Engineering, University of Vigo, Lagoas Marcosende s/n, E-36310 Vigo, Spain.	Spain	2012	10.1016/j.biortech.2012.05.144
22342900	Degradation of estrogens by laccase from Myceliophthora thermophila in fed-batch and enzymatic membrane reactors	Several studies reported that tural and synthetic estrogens are the major contributors to the estrogenic activity associated with the effluents of wastewater treatment plants. The ability of the enzyme laccase to degrade these compounds in batch experiments has been demonstrated in previous studies. Nevertheless, information is scarce regarding in vitro degradation of estrogens in continuous enzymatic bioreactors. The present work constitutes an important step forward for the implementation of an enzymatic reactor for the continuous removal of estrone (E1) and estradiol (E2) by free laccase from Myceliophthora thermophila. In a first step, the effect of the main process parameters (pH, enzyme level, gas composition (air or oxygen) and estrogen feeding rate) were evaluated in fed-batch bioreactors. E1 and E2 were oxidized by 94.1 and 95.5%, respectively, under the best conditions evaluated. Thereafter, an enzymatic membrane reactor (EMR) was developed to perform the continuous degradation of the estrogens. The configuration consisted of a stirred tank reactor coupled with an ultrafiltration membrane, which allowed the recovery of enzyme while both estrogens and degradation products could pass through it. The highest removal rates at steady state conditions were up to 95% for E1 and nearly complete degradation for E2. Furthermore, the residual estrogenic activity of the effluent was largely reduced up to 97%.		Journal of hazardous materials	Dept. of Chemical Engineering, School of Engineering, University of Santiago de Compostela, E-15782 Santiago de Compostela, Spain.	Spain	2012	10.1016/j.jhazmat.2012.01.082
