PMID	Title	Abstract	Keywords	Journal	Institution	Country	Year	DOI
28515785	Recombint expression of thermostable processive MtEG5 endoglucase and its synergism with MtLPMO from Myceliophthora thermophila during the hydrolysis of lignocellulosic substrates	BACKGROUND: Filamentous fungi are among the most powerful cellulolytic organisms in terrestrial ecosystems. To perform the degradation of lignocellulosic substrates, these microorganisms employ both hydrolytic and oxidative mechanisms that involve the secretion and synergism of a wide variety of enzymes. Interactions between these enzymes occur on the level of saccharification, i.e., the release of neutral and oxidized products, but sometimes also reflected in the substrate liquefaction. Although the synergism regarding the yield of neutral sugars has been extensively studied, further studies should focus on the oxidized sugars, as well as the effect of enzyme combitions on the viscosity properties of the substrates. RESULTS: In the present study, the heterologous expression of an endoglucase (EG) and its combined activity together with a lytic polysaccharide monooxygese (LPMO), both from the thermophilic fungus Myceliophthora thermophila, are described. The EG gene, belonging to the glycoside hydrolase family 5, was functiolly expressed in the methylotrophic yeast Pichia pastoris. The produced MtEG5A (75 kDa) featured remarkable thermal stability and showed high specific activity on microcrystalline cellulose compared to CMC, which is indicative of its processivity properties. The enzyme was capable of releasing high amounts of cellobiose from wheat straw, birch, and spruce biomass. Addition of MtLPMO9 together with MtEG5A showed enhanced enzymatic hydrolysis yields against regenerated amorphous cellulose (PASC) by improving the release not only of the neutral but also of the oxidized sugars. Assessment of activity of MtEG5A on the reduction of viscosity of PASC and pretreated wheat straw using dymic viscosity measurements revealed that the enzyme is able to perform liquefaction of the model substrate and the tural lignocellulosic material, while when added together with MtLPMO9, no further synergistic effect was observed. CONCLUSIONS: The endoglucase MtEG5A from the thermophilic fungus M. thermophila exhibited excellent properties that render it a suitable candidate for use in biotechnological applications. Its strong synergism with LPMO was reflected in sugars release, but not in substrate viscosity reduction. Based on the level of oxidative sugar formation, this is the first indication of synergy between LPMO and EG reported.	Endoglucase, LPMO, Myceliophthora thermophila, Pichia pastoris, Processivity, Viscosity	Biotechnology for biofuels	Biochemical Process Engineering, Chemical Engineering, Department of Civil, Environmental and Natural Resources Engineering, Lulea University of Technology, Lulea, Sweden. ISNI: 0000 0001 1014 8699. GRID: grid.6926.b	Sweden	2017	10.1186/s13068-017-0813-1
28501686	Immobilisation on mesoporous silica and solvent rinsing improve the transesterification abilities of feruloyl esterases from Myceliophthora thermophila	The immobilisation of four feruloyl esterases (FAEs) (FaeA1, FaeA2, FaeB1, FaeB2) from the thermophilic fungus Myceliophthora thermophila C1 was studied and optimised via physical adsorption onto various mesoporous silica particles with pore diameters varying from 6.6nm to 10.9nm. Using crude enzyme preparations, enrichment of immobilised FAEs was observed, depending on pore diameter and protein size. The immobilised enzymes were successfully used for the synthesis of butyl ferulate through transesterification of methyl ferulate with 1-butanol. Although the highest butyl ferulate yields were obtained with free enzyme, the synthesis-to-hydrolysis ratio was higher when using immobilised enzymes. Over 90% of the initial activity was observed in a reUSAbility experiment after nine reaction cycles, each lasting 24h. Rinsing with solvent to remove water from the immobilised enzymes further improved their activity. This study demonstrates the suitability of immobilised crude enzyme preparations in the development of biocatalysts for esterification reactions.	Biocatalysis, Butyl ferulate, Enzyme immobilisation, Esterification, SBA-15	Bioresource technology	Department of Biology and Biological Engineering, Division of Industrial Biotechnology, Chalmers University of Technology, SE-412 96 Gothenburg, Sweden. Electronic address: huttner@chalmers.se.	Sweden	2017	10.1016/j.biortech.2017.04.106
28078397	Optimized synthesis of novel prenyl ferulate performed by feruloyl esterases from Myceliophthora thermophila in microemulsions	Five feruloyl esterases (FAEs; EC 3.1.1.73), FaeA1, FaeA2, FaeB1, and FaeB2 from Myceliophthora thermophila C1 and MtFae1a from M. thermophila ATCC 42464, were tested for their ability to catalyze the transesterification of vinyl ferulate (VFA) with prenol in detergentless microemulsions. Reaction conditions were optimized investigating parameters such as the medium composition, the substrate concentration, the enzyme load, the pH, the temperature, and agitation. FaeB2 offered the highest transesterification yield (71.5 +/- 0.2%) after 24 h of incubation at 30  degrees C using 60 mM VFA, 1 M prenol, and 0.02 mg FAE/mL in a mixture comprising of 53.4:43.4:3.2 v/v/v n-hexane:t-butanol:100 mM MOPS-OH, pH 6.0. At these conditions, the competitive side hydrolysis of VFA was 4.7-fold minimized. The ability of prenyl ferulate (PFA) and its corresponding ferulic acid (FA) to scavenge 1,1-diphenyl-2-picrylhydrazyl (DPPH) radicals was significant and similar (IC(50) 423.39 muM for PFA, 329.9 muM for FA). PFA was not cytotoxic at 0.8-100 muM (IC(50) 220.23 muM) and reduced intracellular reactive oxygen species (ROS) in human skin fibroblasts at concentrations ranging between 4 and 20 muM as determined with the dichloro-dihydro-fluorescein diacetate (DCFH-DA) assay.	Antioxidant, DCFH-DA, DPPH, Feruloyl esterase, Myceliophthora thermophila, Prenyl ferulate, Transesterification	Applied microbiology and biotechnology	Division of Chemical Engineering, Department of Civil, Environmental and Natural Resources Engineering, Lulea University of Technology, 97187, Lulea, Sweden.	Sweden	2017	10.1007/s00253-017-8089-8
28649275	Magement of enzyme diversity in high-performance cellulolytic cocktails	BACKGROUND: Modern biorefineries require enzymatic cocktails of improved efficiency to generate fermentable sugars from lignocellulosic biomass. Cellulolytic fungi, among other microorganisms, have demonstrated the highest potential in terms of enzymatic productivity, complexity and efficiency. On the other hand, under cellulolytic-inducing conditions, they often produce a considerable diversity of carbohydrate-active enzymes which allow them to adapt to changing environmental conditions. However, industrial conditions are fixed and adjusted to the optimum of the whole cocktail, resulting in underperformance of individual enzymes. RESULTS: One of these cellulolytic cocktails from Myceliophthora thermophila has been alyzed here by means of LC-MS/MS. Pure GH6 family members detected have been characterized, confirming previous studies, and added to whole cocktails to compare their contribution in the hydrolysis of industrial substrates. Filly, independent deletions of two GH6 family members, as an example of the enzymatic diversity magement, led to the development of a strain producing a more efficient cellulolytic cocktail. CONCLUSIONS: These data indicate that the deletion of noncontributive cellulases (here EG VI) can increase the cellulolytic efficiency of the cocktail, validating the magement of cellulase diversity as a strategy to obtain improved fungal cellulolytic cocktails.	Bioethanol, Cellulolytic cocktail improvement, Enzymatic hydrolysis, Lignocellulosic biomass	Biotechnology for biofuels	Department of Biotechnology, Abengoa Research, Campus Palmas Altas, C/Energia Solar 1, 41014 Seville, Spain.	Spain	2017	10.1186/s13068-017-0845-6
28710860	Coupling the pretreatment and hydrolysis of lignocellulosic biomass by the expression of beta-xylosidases	Thermochemical pretreatment and enzymatic hydrolysis are the areas contributing most to the operatiol costs of second generation ethanol in lignocellulosic biorefineries. The improvement of lignocellulosic enzyme cocktails has been significant in the recent years. Although the needs for the reduction of the energy intensity and chemical consumption in the pretreatment step are well known, the reduction of the severity of the process strongly affects the enzymatic hydrolysis yield. To explore the formulation requirements of the well known cellulolytic cocktail from Myceliophthora thermophila on mild pretreated raw materials, this cocktail was tested on steam exploded corn stover without acid impregtion. The low hemicellulose yield and significant accumulation of xylobiose compared with the standard pretreated material obtained with dilute acid impregtion evidenced a clear limitation in the conversion of xylan to xylose. In order to complement the beta-xylosidase limitation, a selection of enzymes was expressed and tested in this fungus. A controlled expression of xylosidases from Aspergillus nidulans, Aspergillus fumigatus, and FUSArium oxysporum allowed recovering hemicellulose yields reached with standard acid treated material. The results underline the need of parallel development of the pretreatment process with the optimization of the formulation of the enzymatic cocktails.	beta-xylosidase, biofuels, biorefinery, enzymatic hydrolysis, lignocellulosic biomass	Biotechnology and bioengineering	Department of Biotechnology, Abengoa Research, Campus Palmas Altas, Seville, Spain.	Spain	2017	10.1002/bit.26386
28777990	Additives enhancing enzymatic hydrolysis of lignocellulosic biomass	Linked to the development of cellulolytic enzyme cocktails from Myceliophthora thermophila, we studied the effect of different additives on the enzymatic hydrolysis yield. The hydrolysis of pretreated corn stover (PCS), sugar cane straw (PSCS) and microcrystalline cellulose (Avicel) was performed under industrial conditions using high solid loadings, limited mixing, and low enzyme dosages. The addition of polyethylene glycol (PEG4000) allowed to increase the glucose yields by 10%, 7.5%, and 32%, respectively in the three materials. PEG4000 did not have significant effect on the stability of the main individual enzymes but increased beta-glucosidase and endoglucase activity by 20% and 60% respectively. Moreover, the presence of PEG4000 accelerated cellulase-catalyzed hydrolysis reducing up to 25% the liquefaction time. However, a prelimiry economical assessment concludes that even with these improvements, a lower contribution of PEG4000 to the 2G bioethanol production costs would be needed to reach commercial feasibility.	Additives, Enzymatic hydrolysis, Lignocellulose, Myceliophthora thermophila	Bioresource technology	Department of Biotechnology, Abengoa Research, Campus Palmas Altas, C/ Energia Solar n degrees  1, 41014 Seville, Spain.	Spain	2017	10.1016/j.biortech.2017.06.132
28805314	Evolved alpha-factor prepro-leaders for directed laccase evolution in Saccharomyces cerevisiae	Although the functiol expression of fungal laccases in Saccharomyces cerevisiae has proven to be complicated, the replacement of sigl peptides appears to be a suitable approach to enhance secretion in directed evolution experiments. In this study, twelve constructs were prepared by fusing tive and evolved alpha-factor prepro-leaders from S. cerevisiae to four different laccases with low-, medium- and high-redox potential (PM1L from basidiomycete PM1; PcL from Pycnoporus cinbarinus; TspC30L from Trametes sp. strain C30; and MtL from Myceliophthora thermophila). Microcultures of the prepro-leader:laccase fusions were grown in selective expression medium that used galactose as both the sole carbon source and as the inducer of expression so that the secretion and activity were assessed with low- and high-redox potential mediators in a high-throughput screening context. With total activity improvements as high as sevenfold over those obtained with the tive alpha-factor prepro-leader, the evolved prepro-leader from PcL (alpha(PcL) ) most strongly enhanced secretion of the high- and medium-redox potential laccases PcL, PM1L and TspC30L in the microtiter format with an expression pattern driven by prepro-leaders in the order alpha(PcL)  > alpha(PM)(1L)  ~ alpha(tive) . By contrast, the pattern of the low-redox potential MtL was alpha(tive)  > alpha(PcL)  > alpha(PM)(1L) . When produced in flask with rich medium, the evolved prepro-leaders outperformed the alpha(tive) sigl peptide irrespective of the laccase attached, enhancing secretion over 50-fold. Together, these results highlight the importance of using evolved alpha-factor prepro-leaders for functiol expression of fungal laccases in directed evolution campaigns.		Microbial biotechnology	Department of Biocatalysis, Institute of Catalysis, CSIC, Cantoblanco, 28049, Madrid, Spain.	Spain	2017	10.1111/1751-7915.12838
32624738	Ultrasound-assisted swelling of bacterial cellulose	Bacterial cellulose (BC) was obtained by static cultivation using commercial BC gel from scoby. BC membranes (oven dried and freeze-dried) were swelled with 8% OH, in the absence and in the presence of ultrasound (US), for 30, 60, and 90 min. The influence of swelling conditions on both physico-chemical properties and molecules entrapment was evaluated. Considering the highest levels of entrapment, an optimum swelling procedure was established: 8% OH for 30 min at room temperature in the presence of US. tive and PEGylated laccase from Myceliophthora thermophila was immobilized on BC membranes and a different catalytic behaviour was observed after immobilization. tive laccase presented activity values similar to published reports (5-7 U/gBC) after immobilization whereas PEGylated enzymes showed much lower activity (1-2 U/gBC). BC swelled membranes are presented herein as a potential support for the preparation of immobilized enzymes for industrial applications, like phenolics polymerization.	Bacterial cellulose, PEG-FITC, Polymerization, Swelling, Ultrasound	Engineering in life sciences	Department of Clothing and Textiles Sookmyung Women's University Seoul South Korea.	South korea	2017	10.1002/elsc.201700085
29100178	Monitoring of reactions catalyzed by lytic polysaccharide monooxygeses using highly-sensitive fluorimetric assay of the oxygen consumption rate	Lytic polysaccharide monooxygeses (LPMOs) are recently discovered enzymes that catalyze the oxidative deconstruction of polysaccharides. However fast and reliable methods of determition of LPMO activity still need to be developed, especially those based on the initial reaction rates. A method based on the oxygen consumption rate (OCR) measurements, using a Seahorse XFp Alyzer with highly-sensitive fluorimetric sensors, was applied for monitoring the oxidation of amorphous cellulose by three fungal LPMOs: recombint enzymes from Thielavia terrestris (GH61E), Trichoderma reesei (Cel61A), and a tive LPMO9A from Myceliophthora thermophila. The turnover numbers for 4 muM enzymes acting on 4 mg mL(-1) cellulose at 37  degrees C were 0.88, 1.26 and 0.93 min(-1), respectively. A possibility of feeding the dissolved reagents into the reaction system during measurements with obtaining a simultaneous response in the OCR allowed in situ monitoring the LPMO inhibition and activation by EDTA and Cu(2+) ions as well as studying other effects on the enzymatic reaction.	Lytic polysaccharide monooxygese, Myceliophthora thermophila, Oxygen consumption rate, Thielavia terrestris, Trichoderma reesei	Carbohydrate research	"Department of Chemistry, M. V. Lomonosov Moscow State University, Vorobyovy Gory 1/11, Moscow 119991, Russia; Federal Research Centre ""Fundamentals of Biotechnology"", Russian Academy of Sciences, Leninsky Pr. 33, Moscow 119071, Russia. Electronic address: avgusakov@enzyme.chem.msu.ru."	Russia	2017	10.1016/j.carres.2017.10.015
27856189	N-Linked glycans are an important component of the processive machinery of cellobiohydrolases	Cellobiohydrolases (CBHs), belonging to glycoside hydrolase families 6 and 7 (GH6 and GH7), are the major components of cellulase systems of filamentous fungi involved in biodegradation of cellulose in ture. Previous studies demonstrated that N-linked glycans in the catalytic domains of GH7 CBHs significantly affect the enzyme activity against cellulosic substrates. The influence of N-linked glycans on the activity and processivity of recombint GH6 CBH II from Penicillium verruculosum (PvCel6A) was studied using site-directed mutagenesis of the respective Asn residues. Depending on the position of N-glycans on the surface of a protein globule, they affected the enzyme activity against cellulose either negatively or positively. The decrease or increase in the degree of processivity of recombint forms of PvCel6A generally correlated with activity changes against Avicel. The mechanism of the N-glycan influence seems to be universal for GH6 and GH7 CBHs. The observed effects for CBHs from both families are explained in terms of a mechanistic model that also makes clear our previously published data on the highly active CBH IIb from Myceliophthora thermophila (MtCel6B). This study, together with data of other researchers, strongly suggests that the N-linked glycans in the catalytic domains of GH6 and GH7 CBHs are involved in processive catalytic machinery of these enzymes. Data obtained should be taken into account during development of new and more effective biocatalysts by protein engineering techniques.	Cellobiohydrolase, Cloning, N-glycosylation, Processivity, Site-directed mutagenesis	Biochimie	"Department of Chemistry, M. V. Lomonosov Moscow State University, Vorobyovy Gory 1/11, Moscow 119991, Russia; Federal Research Centre ""Fundamentals of Biotechnology"", Russian Academy of Sciences, Leninsky Pr. 33, Moscow 119071, Russia. Electronic address: avgusakov@enzyme.chem.msu.ru."	Russia	2017	10.1016/j.biochi.2016.11.004
28591592	Recombint thermo-alkali-stable endoglucase of Myceliopthora thermophila BJA (rMt-egl): Biochemical characteristics and applicability in enzymatic saccharification of agro-residues	Codon adaptation index (CAI) of a 1263bp long endoglucase encoding gene from the thermophilic mould Myceliopthora thermophile BJA has been improved from 0.44 to 0.76 by in vitro gene synthesis. The codon optimized endoglucase gene (Mt-egl) has been constitutively expressed in Pichia pastoris under the regulation of GAP promoter. Recombint endoglucase (rMt-egl), purified by size exclusion chromatography, has been confirmed to be a monomeric protein of  approximately 47kDa. rMt-egl is optimally active at pH 10 and 50 degrees C, displaying stability in broad pH and temperature ranges, with a t(1/2) of 60 and 15min at 90 and 100 degrees C, respectively. This retained  approximately 70% of activity after 3h incubation at pH 5-12. The K(m), V(max), k(cat) and k(cat)/K(m) of rMt-egl were 5mgmL(-1), 20mumolesmin(-1)mg(-1), 1.02x10(3)s(-1) and 204s(-1)mg(-1)mL(-1), respectively. Homology modeling and bioinformatics alysis confirmed catalytically important role of glutamate 234 and 344. rMt-egl released high amounts of reducing sugars from wheat bran and corn cobs (421 and 382mgg(-1)), thus making it a useful biocatalyst for producing bioethanol and fine chemicals from agro-residues.	Codon optimization, Constitutive expression, Enzymatic saccharification, Myceliophthora thermophila, Thermo-alkali-stable endoglucase, Thermophilic mould	International journal of biological macromolecules	Department of Microbiology, University of Delhi South Campus, Benito Juarez Road, New Delhi 110 021, India.	India	2017	10.1016/j.ijbiomac.2017.05.167
27697488	Bioprocess for the production of recombint HAP phytase of the thermophilic mold Sporotrichum thermophile and its structural and biochemical characteristics	Thermophilc mold Sporotrichum thermophile secretes an acidstable and thermostable phytase, which finds application as a food and feed additive because of its adequate thermostability, acid stability, protease insensitivity and broad substrate spectrum. Low extracellular phytase production by the mold is a major bottleneck for its application on a commercial scale. We have successfully overcome this problem by constitutive secretary expression of codon optimized rStPhy under glyceraldehyde phosphate dehydrogese (GAP) promoter in Pichia pastoris. A  approximately 41-fold improvement in rStPhy production has been achieved. Circular Dichroism (CD) spectra revealed that rStPhy is composed of 26.65% alpha-helices, 5.26% beta-sheets and 68.09% random coils at pH 5.0 and 60 degrees C, the optima for the enzyme activity. The melting temperature (T(m)) of the enzyme is  approximately 73 degrees C. The 3D structure of rStPhy displayed characteristic sigture sequences (RHGXRXP and HD) of HAP phytase. The catalytically important amino acids (Arg74, His75, Arg78, His368 and Asp369) were identified by docking and site directed mutagenesis. Fluorescence quenching by N-bromosuccinimide (NBS) and CsCl exposed tryptophan residues surrounded by negative charges, which play a key role in maintaining structural integrity of rStPhy.	Circular dichroism, Fluorescence quenching, P. pastoris, Recombint phytase, Site-directed mutagenesis, Sporotrichum thermophile	International journal of biological macromolecules	Department of Microbiology, University of Delhi South Campus, New Delhi 110021, India.	India	2017	10.1016/j.ijbiomac.2016.09.102
28466305	Concomitant production of cellulase and xylase by thermophilic mould Sporotrichum thermophile in solid state fermentation and their applicability in bread making	Sporotrichum thermophile BJAMDU5 secreted high titres of xylanolytic and cellulolytic enzymes in solid state fermentation using mixture of wheat straw and cotton oil cake (ratio 1:1) at 45  degrees C, pH 5.0 after 72 h inoculated with 2.9 x 10(7) CFU/mL conidiospores. Supplementation of solid medium with lactose and ammonium sulphate further enhanced the production of hydrolytic enzymes. Among different surfactants studied, Tween 80 enhanced the production of all enzymes [3455 U/g DMR (dry mouldy residue), 879.26 U/g DMR, 976.28 U/g DMR and 35.10 U/g DMR for xylase, CMCase (Carboxymethylcellulase), FPase (Filter paper activity) and beta-glucosidase, respectively] as compared to other surfactants. Recycling of solid substrate reduced the production of all these enzymes after second cycle. End products alysis by TLC showed the ability of hydrolytic enzymes of S. thermophile to liberate monomeric (xylose and glucose) as well as oligomeric (xylobiose, cellobiose and higher ones) sugars. Supplementation of enzyme resulted in improved nutritiol properties of the bread. Formation of oligomeric sugars by xylase enzyme of S. thermophile BJAMDU5 make it a good candidate in food industry.	Bread making, Hydrolytic enzymes, Multiple substrates, Oligosaccharides, Sporotrichum thermophile BJAMDU5	World journal of microbiology & biotechnology	Laboratory of Bioprocess Technology, Department of Microbiology, Maharshi Dayanand University, Rohtak, Haryana, 124001, India.	India	2017	10.1007/s11274-017-2278-6
27796873	Phytase Production and Development of an Ideal Dephytinization Process for Amelioration of Food Nutrition Using Microbial Phytases	Development of an ideal process for reduction of food phytates using microbial phytases is a demanding task by all food and feed industries all over the world. Phytase production by Bacillus subtilis subsp. subtilis JJBS250 isolated from soil sample was optimized in submerged fermentation using statistical tools. Among all the culture variables tested, sucrose, sodium phytate and Tween-80 were identified as the most significant variables using the Placket-Burman design. Further optimization of these variables resulted in a 6.79-fold improvement in phytase production (7170 U/L) as compared to unoptimized medium. Supplementation of microbial phytases (fungal and bacterial) resulted in improved bioavailability of nutritiol components with the concomitant liberation of inorganic phosphorus, reducing sugar, soluble protein and amino acids, thus mitigating anti-nutritiol properties of phytic acid.	Bacillus subtilis subsp. subtilis JJBS250, Dephytinization, Phytase, Response surface methodology, Sporotrichum thermophile	Applied biochemistry and biotechnology	Laboratory of Bioprocess Technology, Department of Microbiology, Maharshi Dayanand University, Rohtak, Haryana, 124001, India.	India	2017	10.1007/s12010-016-2297-z
