PMID	Title	Abstract	Keywords	Journal	Institution	Country	Year	DOI
39048228	Characterization of a novel AA16 lytic polysaccharide monooxygenase from Thermothelomyces thermophilus and comparison of biochemical properties with an LPMO from AA9 family	Lytic polysaccharide monooxygenases (LPMOs) are copper-dependent enzymes which are categorized in the CAZy database under auxiliary activities families AA9-11, 13, 14-17. Secreted by various microorganisms, they play a crucial role in carbon recycling, particularly in fungal saprotrophs. LPMOs oxidize polysaccharides through monooxygenase/peroxygenase activities and exhibit peroxidase and oxidase activities, with variations among different families. AA16, a newly identified LPMO family, is noteworthy due to limited studies on its members, thus rendering the characterization of AA16 enzymes vital for addressing controversies around their functions. This study focused on heterologous expression and biochemical study of an AA16 LPMO from Thermothelomyces thermophilus (formerly known as Myceliophthora thermophila), namely MtLPMO16A. Substrate specificity evaluation of MtLPMO16A showed oxidative cleavage of hemicellulosic substrates and no activity on cellulose, accompanied by a strong oxidase activity. A comparative analysis with an LPMO from AA9 family explored correlations between these families, while MtLPMO16A was shown to boost the activity of some AA9 family LPMOs. The results offer new insights into the AA16 family's action mode and microbial hemicellulose decomposition mechanisms in nature.	AA16, Beechwood xylan, Electron donors, LPMO, Oxidase, Oxidoreductases, Thermothelomyces thermophilus	Carbohydrate polymers	Iotandustrial Biotechnology & Biocatalysis Group, School of Chemical Engineering, National Technical University of Athens, Zografou Campus, 15772, Greece.	Greece	2024	10.1016/j.carbpol.2024.122387
37977536	Laccase-mediated degradation of petroleum hydrocarbons in historically contaminated soil	Laccases (EC1.10.3.2) have attracted growing attention in bioremediation research due to their high reactivity and substrate versatility. In this study, three genes for potential novel laccases were identified in an enrichment culture from contaminated field soil and recombinantly expressed in E. coli. Two of them, designated as PlL and BaL, were biochemically characterized regarding their optimal pH and temperature, kinetic parameters, and substrate versatility. In addition, lacasse PlL from Parvibaculum lavamentivorans was tested on historically contaminated soil. Treatment with PlL led to a significantly higher reduction of total petroleum hydrocarbons (83% w/w) compared to the microbial control (74% w/w). Hereby, PlL was especially effective in degrading hydrocarbons > C17. Their residual concentration was by 43% w/w lower than in the microbial treatment. In comparison to the laccase from Myceliophthora thermophila (MtL), PlL treatment was not significantly different for the fraction > C17 but resulted in a 30% (w/w) lower residual concentration for hydrocarbons < C18. In general, PlL can promote the degradation of petroleum hydrocarbons. As a consequence, it can be applied to reduce remediation time by duly achieving remediation target concentrations needed for site closure.	Bioremediation, Laccase, Polyaromatic hydrocarbons	Chemosphere	Institute of Environmental Biotechnology, University of Natural Resources and Life Sciences (BOKU), Tulln, Austria.	Austria	2024	10.1016/j.chemosphere.2023.140733
39292681	Laccase-mediated chemoselective C-4 arylation of 5-aminopyrazoles	Chemoselective arylation of 5-aminopyrazoles was performed through oxidative formation of orthoquinones from catechols catalyzed by Myceliophthora thermophila laccase (Novozym 51003), and subsequently nucleophilic attack of 5-aminopyrazole to the catechol intermediates. The C-4 arylated products were obtained under extremely mild conditions without the need for amine protection or halogenation of the substrates. From this method, 10 derivatives with moderate to good efficiency (42-94%) were prepared.		PloS one	Department of Organic Chemistry, Shahid Beheshti University, Tehran, Iran.	Iran	2024	10.1371/journal.pone.0308036
39194835	A Treatment for Rice Straw and Its Use for Mealworm (Tenebrio molitor L.) Feeding: Effect on Insect Performance and Diet Digestibility	The development of reuse processes for plant by-products for both animal and human food offers numerous possibilities for quality-of-life improvements that align with a circular economy model. For this reason, we divided this study into two experiments. First, we designed a combined treatment consisting of laccase, ultrasound, and ascorbic acid to hydrolyze rice straw plant fibers and used the resulting feed as the basis for T. molitor diets. Second, we formulated diets with different inclusion levels (0%, 25%, 50%, 75%, and 100%) of rice straw and treated rice straw to assess their impact on larvae growth and diet digestibility. For each treatment, six replicates were employed: four for the growth-performance-digestibility trial and two for complementary uric acid determination tests. The combined laccase enzyme, ultrasound, and ascorbic acid treatment hydrolyzed 13.2% of the vegetable fibers. The diets containing treated rice straw resulted in higher larvae weight and a better feed conversion ratio; however, reaching 100% by-product inclusion values led to similar results between both diets. In conclusion, these treatments improve the potential of low-nutritional-value vegetable by-products as part of a T. molitor diet, opening the possibility of new methodologies for the use of recalcitrant vegetable by-products for insect rearing.	Myceliophthora thermophila, agro-industrial by-products, feed conversion ratio, insect larvae, laccase activity	Insects	"Group of Research Food Biotechnology-BTA, Department of Food Science, Nutrition and Bromatology, Regional Campus of International Excellence ""Campus Mare Nostrum"", University of Murcia, Espinardo, 30100 Murcia, Spain."	Spain	2024	10.3390/insects15080631
39051740	Biocatalytic Synthesis of Nitrile-Bearing All-Carbon Quaternary Stereocenters	The synthesis of all-carbon quaternary stereocenters containing nitriles is a very important and challenging subject in organic chemistry. We used a biocatalytic approach under mild conditions to obtain new derivatives of these scaffolds by oxidation of catechols by Myceliophthora thermophila laccase (Novozym 51003) to afford o-quinones and 1,4-addition of a series of carbon nucleophiles containing tertiary alkyle nitriles to these intermediates. Using this approach, alpha-cyano carbonyls bearing a quaternary stereocenter were also prepared. Finally, the yields for the prepared compounds were 72-94%.		The Journal of organic chemistry	Department of Organic Chemistry, Shahid Beheshti University, 1983969411 Tehran, Iran.	Iran	2024	10.1021/acs.joc.4c00793
38462117	Genomic characterization and expression profiling of the lytic polysaccharide monooxygenases AA9 family in thermophilic fungi Thermothelomyces fergusii in response to carbon source media	Enhancing enzyme activity and stability in biomass degradation can improve substrate saccharification and, increases biorefinery efficiency. For the first time, we identified 20 lytic polysaccharide monooxygenases (LPMOs) AA9 genes in the genome of Thermothelomyces fergusii. Our results showed that TfAA9 was categorized into LPMOs1, LPMOs2, and LPMOs3 subgroups based on protein diversity. Protein- 3D structure analysis showed strong interactions between Myceliophthora thermophila AA9 proteins and 17 TfAA9 proteins. Gene ontology analysis indicated a high enrichment of cellulase activity in TfAA9 genes. KEGG pathways analysis revealed the role of TfAA9 proteins in the endohydrolysis of 1,4-beta-D-glucosidic linkages in cellulose. Numerous TfAA9s gene transcripts were up-regulated on avicel, cellobiose, and glucose, with a higher proportion on avicel. Protein concentration, endoglucanase, and cellulase activity were also boosted on avicel. However, limited fungal biomass was observed on avicel, despite the abundance of AA9 LPMOs in the T. fergusii genome. These findings expand our understanding of fungal AA9 genes and their role in lignocellulolytic degradation. The disparity between biomass and enzymatic activity suggests screening TfAA9 genes for highly active enzymes and redundant genes via heterologous expression. In short, functional characterization of these genes could contribute to improving the saccharification process of industrial raw materials.	Enzymatic activity, Gene expression, Reducing sugar	International journal of biological macromolecules	Shenzhen Key Laboratory of Microbial Genetic Engineering, College of Life Sciences and Oceanography, Shenzhen University, Shenzhen 518060, China; College of Physics and Optoelectronic Engineering, Shenzhen University, Shenzhen 518060, China.	China	2024	10.1016/j.ijbiomac.2024.130740
39187522	Exploring the hidden hot world of long non-coding RNAs in thermophilic fungus using a robust computational pipeline	Long noncoding RNAs (lncRNAs) are versatile RNA molecules recently identified as key regulators of gene expression in response to environmental stress. Our primary focus in this study was to develop a robust computational pipeline for identifying structurally identical lncRNAs across replicates from publicly available bulk RNA-seq datasets. In order to demonstrate the effectiveness of the pipeline, we utilized the transcriptome of the thermophilic fungus Thermothelomyces thermophilus and assessed the expression pattern of lncRNAs in conjunction with Heat Shock Proteins (HSP), a well-known protein family critical for the cell's response to high temperatures. Our findings demonstrate that the identification of structurally identical transcripts among replicates in this thermophilic fungus ensures the reliability and accuracy of RNA studies, contributing to the validity of biological interpretations. Furthermore, the majority of lncRNAs exhibited a distinct expression pattern compared to HSPs. Our study contributes to advancing the understanding of the biological mechanisms comprising lncRNAs in thermophilic fungi.	Thermothelomyces thermophilus, Long non-coding RNA, Structurally identical transcripts, Transcriptome assembly	Scientific reports	Molecular and Computational Biology of Fungi Laboratory, Department of Microbiology, Institute of Biological Sciences, Federal University of Minas Gerais, Belo Horizonte, MG, Brazil.	Brazil	2024	10.1038/s41598-024-67975-x
38380057	Independent metabolism of oligosaccharides is the keystone of synchronous utilization of cellulose and hemicellulose in Myceliophthora	The effective utilization of cellulose and hemicellulose, the main components of plant biomass, is a key technical obstacle that needs to be overcome for the economic viability of lignocellulosic biorefineries. Here, we firstly demonstrated that the thermophilic cellulolytic fungus Myceliophthora thermophila can simultaneously utilize cellulose and hemicellulose, as evidenced by the independent uptake and intracellular metabolism of cellodextrin and xylodextrin. When plant biomass serviced as carbon source, we detected the cellodextrin and xylodextrin both in cells and in the culture medium, as well as high enzyme activities related to extracellular oligosaccharide formation and intracellular oligosaccharide hydrolysis. Sugar consumption assay revealed that in contrast to inhibitory effect of glucose on xylose and cellodextrin/xylodextrin consumption in mixed-carbon media, cellodextrin and xylodextrin were synchronously utilized in this fungus. Transcriptomic analysis also indicated simultaneous induction of the genes involved in cellodextrin and xylodextrin metabolic pathway, suggesting carbon catabolite repression (CCR) is triggered by extracellular glucose and can be eliminated by the intracellular hydrolysis and metabolism of oligosaccharides. The xylodextrin transporter MtCDT-2 was observed to preferentially transport xylobiose and tolerate high cellobiose concentrations, which helps to bypass the inhibition of xylobiose uptake. Furthermore, the expression of cellulase and hemicellulase genes was independently induced by their corresponding inducers, which enabled this strain to synchronously utilize cellulose and hemicellulose. Taken together, the data presented herein will further elucidate the degradation of plant biomass by fungi, with implications for the development of consolidated bioprocessing-based lignocellulosic biorefinery.	Myceliophthora thermophila, carbon catabolite repression, cellulose and hemicellulose, fungal biotechnology, independent utilization	PNAS nexus	Key Laboratory of Engineering Biology for Low-carbon Manufacturing, Tianjin Institute of Industrial Biotechnology, Chinese Academy of Sciences, Tianjin 300308, China.	China	2024	10.1093/pnasnexus/pgae053
38122901	Carbohydrate-binding modules enhance H(2)O(2) tolerance by promoting lytic polysaccharide monooxygenase active site H(2)O(2) consumption	Lytic polysaccharide monooxygenases (LPMOs) oxidatively depolymerize recalcitrant polysaccharides, which is important for biomass conversion. The catalytic domains of many LPMOs are linked to carbohydrate-binding modules (CBMs) through flexible linkers, but the function of these CBMs in LPMO catalysis is not well understood. In this study, we utilized MtLPMO9L and MtLPMO9G derived from Myceliophthora thermophila to investigate the impact of CBMs on LPMO activity, with particular emphasis on their influence on H(2)O(2) tolerance. Using truncated forms of MtLPMO9G generated by removing the CBM, we found reduced substrate binding affinity and enzymatic activity. Conversely, when the CBM was fused to the C terminus of the single-domain MtLPMO9L to create MtLPMO9L-CBM, we observed a substantial improvement in substrate binding affinity, enzymatic activity, and notably, H(2)O(2) tolerance. Furthermore, molecular dynamics simulations confirmed that the CBM fusion enhances the proximity of the active site to the substrate, thereby promoting multilocal cleavage and impacting the exposure of the copper active site to H(2)O(2). Importantly, the fusion of CBM resulted in more efficient consumption of H(2)O(2) by LPMO, leading to improved enzymatic activity and reduced auto-oxidative damage of the copper active center.	H(2)O(2) tolerance, activity, carbohydrate-binding module, cellulose, lytic polysaccharide monooxygenase, substrate binding affinity	The Journal of biological chemistry	Dalian Engineering Research Center for Carbohydrate Agricultural Preparations, Dalian Technology Innovation Center for Green Agriculture, Liaoning Provincial Key Laboratory of Carbohydrates, Dalian Institute of Chemical Physics, Chinese Academy of Sciences, Dalian, China; University of Chinese Academy of Sciences, Beijing, China.	China	2024	10.1016/j.jbc.2023.105573
38392793	Secretome Analysis of Thermothelomyces thermophilus LMBC 162 Cultivated with Tamarindus indica Seeds Reveals CAZymes for Degradation of Lignocellulosic Biomass	The analysis of the secretome allows us to identify the proteins, especially carbohydrate-active enzymes (CAZymes), secreted by different microorganisms cultivated under different conditions. The CAZymes are divided into five classes containing different protein families. Thermothelomyces thermophilus is a thermophilic ascomycete, a source of many glycoside hydrolases and oxidative enzymes that aid in the breakdown of lignocellulosic materials. The secretome analysis of T. thermophilus LMBC 162 cultivated with submerged fermentation using tamarind seeds as a carbon source revealed 79 proteins distributed between the five diverse classes of CAZymes: 5.55% auxiliary activity (AAs); 2.58% carbohydrate esterases (CEs); 20.58% polysaccharide lyases (PLs); and 71.29% glycoside hydrolases (GHs). In the identified GH families, 54.97% are cellulolytic, 16.27% are hemicellulolytic, and 0.05 are classified as other. Furthermore, 48.74% of CAZymes have carbohydrate-binding modules (CBMs). Observing the relative abundance, it is possible to state that only thirteen proteins comprise 92.19% of the identified proteins secreted and are probably the main proteins responsible for the efficient degradation of the bulk of the biomass: cellulose, hemicellulose, and pectin.	CAZymes, Thermothelomyces thermophilus, lignocellulosic biomass, secretome, tamarind seeds	Journal of fungi (Basel, Switzerland)	Departamento de Bioquimica e Imunologia, Faculdade de Medicina de Ribeirao Preto, Universidade de Sao Paulo, Ribeirao Preto 14049-900, SP, Brazil.	Brazil	2024	10.3390/jof10020121
39142195	Rational design on loop regions for precisely regulating flexibility of catalytic center to mitigate overoxidation of prazole sulfides by Baeyer-Villiger monooxygenase	S-omeprazole and R-rabeprazole are important proton pump inhibitors (PPIs) used for treating peptic disorders. They can be biosynthesized from the corresponding sulfide catalyzed by Baeyer-Villiger monooxygenases (BVMOs). During the development of BVMOs for target sulfoxide preparation, stereoselectivity and overoxidation degree are important factors considered most. In the present study, LnPAMO-Mu15 designed previously and TtPAMO from Thermothelomyces thermophilus showed high (S)- and (R)-configuration stereoselectivity respectively towards thioethers. TtPAMO was found to be capable of oxidating omeprazole sulfide (OPS) and rabeprazole sulfide (RPS) into R-omeprazole and R-rabeprazole respectively. However, the overoxidation issue existed and limited the application of TtPAMO in the biosynthesis of sulfoxides. The structural mechanisms for adverse stereoselectivity between LnPAMO-Mu15 and TtPAMO towards OPS and the overoxidation of OPS by TtPAMO were revealed, based on which, TtPAMO was rationally designed focused on the flexibility of loops near catalytic sites. The variant TtPAMO-S482Y was screened out with lowest overoxidation degree towards OPS and RPS due to the decreased flexibility of catalytic center than TtPAMO. The success in this study not only proved the rationality of the overoxidation mechanism proposed in this study but also provided hints for the development of BVMOs towards thioether substrate for corresponding sulfoxide preparation.	Baeyer-Villiger monooxygenase, Flexibility, Overoxidation, R-rabeprazole, S-omeprazole, Stereoselectivity	Bioorganic chemistry	College of Biological Science and Engineering, Fuzhou University, Fuzhou 350116, China; Institute of Enzyme Catalysis and Synthetic Biotechnology, Fuzhou University, Fuzhou 350108, China.	China	2024	10.1016/j.bioorg.2024.107718
38750569	Construction of an enzyme-constrained metabolic network model for Myceliophthora thermophila using machine learning-based k(cat) data	BACKGROUND: Genome-scale metabolic models (GEMs) serve as effective tools for understanding cellular phenotypes and predicting engineering targets in the development of industrial strain. Enzyme-constrained genome-scale metabolic models (ecGEMs) have emerged as a valuable advancement, providing more accurate predictions and unveiling new engineering targets compared to models lacking enzyme constraints. In 2022, a stoichiometric GEM, iDL1450, was reconstructed for the industrially significant fungus Myceliophthora thermophila. To enhance the GEM's performance, an ecGEM was developed for M. thermophila in this study. RESULTS: Initially, the model iDL1450 underwent refinement and updates, resulting in a new version named iYW1475. These updates included adjustments to biomass components, correction of gene-protein-reaction (GPR) rules, and a consensus on metabolites. Subsequently, the first ecGEM for M. thermophila was constructed using machine learning-based k(cat) data predicted by TurNuP within the ECMpy framework. During the construction, three versions of ecGEMs were developed based on three distinct k(cat) collection methods, namely AutoPACMEN, DLKcat and TurNuP. After comparison, the ecGEM constructed using TurNuP-predicted k(cat) values performed better in several aspects and was selected as the definitive version of ecGEM for M. thermophila (ecMTM). Comparing ecMTM to iYW1475, the solution space was reduced and the growth simulation results more closely resembled realistic cellular phenotypes. Metabolic adjustment simulated by ecMTM revealed a trade-off between biomass yield and enzyme usage efficiency at varying glucose uptake rates. Notably, hierarchical utilization of five carbon sources derived from plant biomass hydrolysis was accurately captured and explained by ecMTM. Furthermore, based on enzyme cost considerations, ecMTM successfully predicted reported targets for metabolic engineering modification and introduced some new potential targets for chemicals produced in M. thermophila. CONCLUSIONS: In this study, the incorporation of enzyme constraint to iYW1475 not only improved prediction accuracy but also broadened the model's applicability. This research demonstrates the effectiveness of integrating of machine learning-based k(cat) data in the construction of ecGEMs especially in situations where there is limited measured enzyme kinetic parameters for a specific organism.	Myceliophthora thermophila, Carbon source hierarchy utilization, Enzyme-constrained model, Machine learning, Metabolic engineering	Microbial cell factories	Key Laboratory of Industrial Fermentation Microbiology of the Ministry of Education, Tianjin Key Laboratory of Industrial Microbiology, College of Biotechnology, Tianjin University of Science and Technology, Tianjin, 300457, China.	China	2024	10.1186/s12934-024-02415-z
39304049	Exploring novel potential of mycosynthesized magnetic nanoparticles for phosphatase immobilization and biological activity	Among different microbes, fungi are proficient candidates for the extracellular synthesis of iron nanoparticles. For biogenic synthesis of iron nanoparticles, a thermophilic mould Myceliophthora thermophila BJTLRMDU7 was used in this study. Mycogenic magnetic nanoparticles were used for phosphatase immobilization and therapeutic applications such as antimicrobial and antimalarial activity. Firstly, the phosphatase was immobilized on biogenic iron nanoparticles with an efficiency of >56鈥%. Immobilized enzyme was optimally active at 60鈥 degrees C and pH鈥5. Immobilized phosphatase was recycled using external magnetic field up to 4th cycle retaining >50鈥% activity. The immobilized phosphatase efficiently released inorganic phosphate from different flours such as wheat, maize and gram at 37鈥 degrees C and 60鈥 degrees C. There was continuous increase in the release of inorganic phosphorus from all samples with incubation time at 37鈥 degrees C and slight reduction at 60鈥 degrees C. These nanoparticles showed the effective antimicrobial activity against Bacillus subtilis, Escherichia coli and Myceliophthora thermophila. Further, the synthesized iron nanoparticles showed antimalarial potential against Plasmodium falciparum. Biogenic nanoparticles did not exhibit hemolytic activity and cytotoxicity. Therefore, biogenic iron nanoparticles could be used as a suitable matrix for immobilization of enzymes and safe therapeutics.	Antimicrobial activity, Enzyme immobilization, Green synthesis, Magnetic nanoparticles, Phosphatase	International journal of biological macromolecules	Department of Biotechnology, Central University of Haryana, Jant-Pali, Mahendergarh 123031, Haryana, India.	India	2024	10.1016/j.ijbiomac.2024.135740
38692377	Recombinant cellobiose dehydrogenase from Thermothelomyces thermophilus: Its functional characterization and applicability in cellobionic acid production	The fungus Thermothelomyces thermophilus is a thermotolerant microorganism that has been explored as a reservoir for enzymes (hydrolytic enzymes and oxidoreductases). The functional analysis of a recombinant cellobiose dehydrogenase (MtCDHB) from T. thermophilus demonstrated a thermophilic behavior, an optimal pH in alkaline conditions for inter-domain electron transfer, and catalytic activity on cellooligosaccharides with different degree of polymerization. Its applicability was evaluated to the sustainable production of cellobionic acid (CBA), a potential pharmaceutical and cosmetic ingredient rarely commercialized. Dissolving pulp was used as a disaccharide source for MtCDHB. Initially, recombinant exoglucanases (MtCBHI and MtCBHII) from T. thermophilus hydrolyzed the dissolving pulp, resulting in 87% cellobiose yield, which was subsequently converted into CBA by MtCDHB, achieving a 66% CBA yield after 24 h. These findings highlight the potential of MtCDHB as a novel approach to obtaining CBA through the bioconversion of a plant-based source.	Aldonic acids, Lignocellulosic materials, Oxidative enzyme, Sustainable process, Thermophilic ascomycete	Bioresource technology	Department of Biotechnology, Lorena School of Engineering, University of Sao Paulo, Lorena, SP, Brazil.	Brazil	2024	10.1016/j.biortech.2024.130763
