PMID	Title	Abstract	Keywords	Journal	Institution	Country	Year	DOI
34735642	Recombint cellobiohydrolase of Myceliophthora thermophila: characterization and applicability in cellulose saccharification	A codon optimized cellobiohydrolase (CBH) encoding synthetic gene of 1188 bp from a thermophilic mold Myceliophthora thermophila (MtCel6A) was cloned and heterologously expressed in Escherichia coli for the first time. In silico alysis suggested that MtCel6A is a GH6 CBH and belongs to CBHII family, which is structurally similar to Cel6A of Humicola insolens. The recombint MtCel6A is expressed as active inclusion bodies, and the molecular mass of the purified enzyme is ~ 45 kDa. The rMtCel6A is active in a wide range of pH (4-12) and temperatures (40-100  degrees C) with optima at pH 10.0 and 60  degrees C. It exhibits T(1/2) of 6.0 and 1.0 h at 60 and 90  degrees C, respectively. The rMtCel6A is an extremozyme with organic solvent, salt and alkali tolerance. The K(m), V(max), k(cat) and k(cat)/K(m) values of the enzyme are 3.2 mg mL(-1), 222.2 mumol mg(-1) min(-1), 2492 s(-1) and 778.7 s(-1) mg(-1) mL(-1), respectively. The product alysis of rMtCel6A confirmed that it is an exoenzyme that acts from the non-reducing end of cellulose. The addition of rMtCel6A to the commercial cellulase mix (Cellic CTec2) led to 1.9-fold increase in saccharification of the pre-treated sugarcane bagasse. The rMtCel6A is a potential CBH that finds utility in industrial processes such as in bioethanol, paper pulp and textile industries.	Alkalistable, Cellulose saccharification, Extremozyme, Recombint cellobiohydrolase, Solvent tolerance, Thermostable cellulose	AMB Express	Department of Biological Sciences & Engineering, Netaji Subhas Institute of Technology (University of Delhi), Azad Hind Fauj Marg, Sector-3 Dwarka, New Delhi, 110078, India.	India	2021	10.1186/s13568-021-01311-8
35155404	Enzymatic Oxidation of Ca-Lignosulfote and Kraft Lignin in Different Lignin-Laccase-Mediator-Systems and MDF Production	Laccase-mediator-oxidized lignin offers replacement for conventiol chemical binders to produce fiberboards. Compared to the previously reported laccase-mediator system (LMS), a lignin-laccase-mediator-system (LLMS) has an advantage in that it requires much shorter fiber-enzyme incubation time due to significantly increased redox reactions. However, the cost of regularly applying laccase on an industrial scale is currently too high. We have employed CcLcc5 from cultures of the basidiomycete Coprinopsis cinerea as a novel basi-laccase (a CAZy subfamily AA1_1 laccase) in medium-density fiberboard (MDF) production, in comparison to the commercial formulation Novozym 51003 with recombintly produced asco-laccase MtL (a CAZy subfamily AA1_3 laccase-like multicopper oxidase from the ascomycete Myceliophthora thermophila). With the best-performing tural mediator 2,6-dimethoxyphenol (DMP), unpurified CcLcc5 was almost as good as formulated Novozym 51003 in increasing the molecular weight (MW) of the technical lignins tested, the hydrophilic high-MW Ca-lignosulfote and the hydrophobic low-MW kraft lignin (Indulin AT). Oxygen consumption rates of the two distantly related, poorly conserved enzymes (31% sequence identity) with different mediators and lignosulfote were also comparable, but Indulin AT significantly reduced the oxidative activity of Novozym 51003 unlike CcLcc5, regardless of the mediator used, either DMP or guaiacol. Oxygen uptake by both laccases was much faster with both technical lignins with DMP than with guaiacol. In case of lignosulfote and DMP, 20-30 min of incubation was sufficient for full oxygen consumption, which fits in well in time with the usual binder application steps in industrial MDF production processes. LLMS-bonded MDF was thus produced on a pilot-plant scale with either crude CcLcc5 or Novozym 51003 at reduced enzyme levels of 5 kU/kg absolutely dry wood fiber with lignosulfote and mediator DMP. Boards produced with CcLcc5 were comparably good as those made with Novozym 51003. Boards reached nearly standard specifications in interl bond strength (IB) and modulus of rupture (MOR), while thickness swelling (TS) was less good based on the hydrophilic character of lignosulfote. LLMS-bonded MDF with Indulin AT and DMP performed better in TS but showed reduced IB and MOR values.	2,6-dimethoxyphenol, Ca-lignosulfote, MDF, asco-laccase MtL, basi-laccase CcLcc5, guaiacol, kraft lignin, mediator	Frontiers in bioengineering and biotechnology	Department of Molecular Wood Biotechnology and Technical Mycology, Busgen-Institute, Georg-August-University of Gottingen, Gottingen, Germany.	Germany	2021	10.3389/fbioe.2021.788622
34631225	Accessing Chemo- and Regioselective Benzylic and Aromatic Oxidations by Protein Engineering of an Unspecific Peroxygese	Unspecific peroxygeses (UPOs) eble oxyfunctiolizations of a broad substrate range with unparalleled activities. Tailoring these enzymes for chemo- and regioselective transformations represents a grand challenge due to the difficulties in their heterologous productions. Herein, we performed protein engineering in Saccharomyces cerevisiae using the MthUPO from Myceliophthora thermophila. More than 5300 transformants were screened. This protein engineering led to a significant reshaping of the active site as elucidated by computatiol modelling. The reshaping was responsible for the increased oxyfunctiolization activity, with improved k (cat)/K (m) values of up to 16.5-fold for the model substrate 5-nitro-1,3-benzodioxole. Moreover, variants were identified with high chemo- and regioselectivities in the oxyfunctiolization of aromatic and benzylic carbons, respectively. The benzylic hydroxylation was demonstrated to perform with entioselectivities of up to 95% ee. The proposed evolutiory protocol and ratiolization of the enhanced activities and selectivities acquired by MthUPO variants represent a step forward toward the use and implementation of UPOs in biocatalytic synthetic pathways of industrial interest.		ACS catalysis	Bioorganic Chemistry, Leibniz Institute of Plant Biochemistry, Weinberg 3, 06120 Halle, Germany.	Germany	2021	10.1021/acscatal.1c00847
33352160	Polymer functiolization through an enzymatic process: Intermediate products characterization and their grafting onto gum Arabic	The modification of gum Arabic with ferulic acid oxidation products was performed in aqueous medium, at 30  degrees C and pH 7.5, in the presence of Myceliophthora thermophila laccase as biocatalyst. First, this study aimed to investigate the structures of the oxidation products of ferulic acid that could possibly be covalently grafted onto gum Arabic. HPLC alyses revealed that this reaction produced several oxidation products, whose structures were investigated using LC-MS/MS alyses (liquid chromatography-mass spectrometry with mass fragmentation alyses) and NMR experiments. The chemical structure of one intermediate reaction product was fully elucidated as the 2-(4-hydroxy-3-methoxyphenyl)-4-[(4-hydroxy-3-methoxyphenyl) methylidene] cyclobutane-1, 3-dione, called by the authors cyclobutadiferulone. Secondly, this study aimed to locate the grafting of the oxidation products onto gum Arabic by performing several NMR experiments. This study did not determine how much and specifically which oxidation products were grafted but some of them were undeniably present onto modified gum Arabic, close to the glucuronic acid C5 carbon or close to the galactose C6 carbon.	Ferulic acid, Functiolization, Gum Arabic, Oxidation product, Phenol grafting	International journal of biological macromolecules	Universite de Lorraine, LIBio, F-54000 Nancy, France.	France	2021	10.1016/j.ijbiomac.2020.12.113
34489024	Kinetic and thermodymic study of laccase cross-linked onto glyoxyl Immobead 150P carrier: Characterization and application for beechwood biografting	In this study, we cross-linked amited Thermothelomyces thermophilus laccase onto Immobead 150P epoxy carrier, and achieved an immobilization yield of 99.84 %. The optimum temperature and pH values for the oxidation of ABTS by laccase were determined to be 70  degrees C and pH 3.0. After 6 h at 50  degrees C, laccase activity was diminished by about 13 % in the free form and 28 %, in the immobilized form. K(m) values for both free and cross-linked laccase were 0.051 and 0.567 mM, whereas V(max) values were 2.027 and 0.854 mumol. min(-1), respectively. The immobilized laccase was able to preserve its full activity for 6 weeks, retaining approximately 95 % and 78 % of its initial activity after 8 and 20 weeks, respectively. The contact angles were two-fold higher when the laccase enzyme was occupied in the biografting reaction, revealing that the hydrophobic compound bonded stably onto beechwood samples.	Biografting, Immobilization, Kinetics, Laccase, Wood hydrophobization	Enzyme and microbial technology	Bioengineering and Sustainable Processes Research Group, Department of Chemical Engineering, University of Vigo, Vigo, 36310, Spain; Microbial Chemistry Department, Genetic Engineering and Biotechnology Research Division, National Research Centre, Dokki, Giza, 12622, Egypt. Electronic address: am.othman@nrc.sci.eg.	Egypt	2021	10.1016/j.enzmictec.2021.109865
34771293	Screening of Lignocellulolytic Enzyme Activities in Fungal Species and Sequential Solid-State and Submerged Cultivation for the Production of Enzyme Cocktails	Various fungal species can degrade lignocellulolytic materials with their enzyme cocktails composed of cellulolytic and lignolytic enzymes. In this work, seven fungal species (Mucor indicus DSM 2185, Paecilomyces variotii CBS 372.70, Myceliophthora thermophila CBS 663.74, Thielavia terrestris CBS 456.75, Botryosphaeria dothidea JCM 2738, FUSArium oxysporum f.sp. langeriae JCM 9293, and FUSArium verticillioides JCM 23107) and four nutrient media were used in the screening for effective lignocellulose degrading enzymes. From the seven tested fungi, F. oxysporum and F. verticilliodes, along with nutrient medium 4, were selected as the best medium and producers of lignocellulolytic enzymes based on the determined xylase (>4 U mg(-1)) and glucase activity ( approximately 2 U mg(-1)). Nutrient medium 4 supplemented with pretreated corn cobs was used in the production of lignocellulolytic enzymes by sequential solid-state and submerged cultivation of F. oxysporum, F. verticilliodes, and a mixed culture of both strains. F. oxysporum showed 6 times higher exoglucase activity (3.33 U mg(-1)) after 5 days of cultivation in comparison with F. verticillioides (0.55 U mg(-1)). F. oxysporum also showed 2 times more endoglucase activity (0.33 U mg(-1)). The mixed culture cultivation showed similar endo- and exoglucase activities compared to F. oxysporum (0.35 U mg(-1); 7.84 U mg(-1)). Maximum xylase activity was achieved after 7 days of cultivation of F. verticilliodes ( approximately 16 U mg(-1)), while F. oxysporum showed maximum activity after 9 days that was around 2 times lower compared to that of F. verticilliodes. The mixed culture achieved maximum xylase activity after only 4 days, but the specific activity was similar to activities observed for F. oxysporum. It can be concluded that both fungal strains can be used as producers of enzyme cocktails for the degradation of lignocellulose containing raw materials, and that corn cobs can be used as an inducer for enzyme production.	FUSArium sp., different fungal species, lignocellulolytic enzymes, pretreated corn cobs, sequential solid state and submerged cultivation, single and mixed fungal species cultivation	Polymers	Laboratory for Biochemical Engineering, Industrial Microbiology and Malting and Brewing Technology, Department of Biochemical Engineering, Faculty of Food Technology and Biotechnology, University of Zagreb, 10000 Zagreb, Croatia.	Croatia	2021	10.3390/polym13213736
31309856	Isolation and characterization of a new cytotoxic polyketide-amino acid hybrid from Thermothelomyces thermophilus ATCC 42464	Fungi are a rich source of novel anticancer compounds. Bioassay-guided isolation has led to the isolation of four polyketide-amino acid hybrid compounds with trans-fused decalin system from the fungus Thermothelomyces thermophilus ATCC 42464 (=Myceliophthora thermophila ATCC 42464): myceliothermophins A, B, E and F (1-4). The structure of the new compound (myceliothermophin F, compound 4) was clearly determined by a combition of nuclear magnetic resonce (NMR) alysis and high-resolution electrospray ionisation mass spectroscopy (HRESIMS). The new compound exhibited promising cytotoxicity against some cell lines derived from colorectal carcinoma, hepatic carcinoma and gastric carcinoma, indicating that compounds with trans-fused decalin system would be promising in the course of developing novel anticancer drugs.	Polyketide-amino acid, Thermothelomyces thermophilus, anticancer, decalin, hybrid	Natural product research	Engineering Research Center of Industrial Microbiology, College of Life Sciences, Fujian Normal University, Fuzhou, China.	China	2021	10.1080/14786419.2019.1641810
33995328	Transcriptiol Profiling of Myceliophthora thermophila on Galactose and Metabolic Engineering for Improved Galactose Utilization	Efficient biological conversion of all sugars from lignocellulosic biomass is necessary for the cost-effective production of biofuels and commodity chemicals. Galactose is one of the most abundant sugar in many hemicelluloses, and it will be important to capture this carbon for an efficient bioconversion process of plant biomass. Thermophilic fungus Myceliophthora thermophila has been used as a cell factory to produce biochemicals directly from renewable polysaccharides. In this study, we draw out the two tive galactose utilization pathways, including the Leloir pathway and oxido-reductive pathway, and identify the significance and contribution of them, through transcriptiol profiling alysis of M. thermophila and its mutants on galactose. We find that galactokise was necessary for galactose transporter expression, and disruption of galK resulted in decreased galactose utilization. Through metabolic engineering, both galactokise deletion and galactose transporter overexpression can activate interl the oxido-reductive pathway and improve the consumption rate of galactose. Filly, the heterologous galactose-degradation pathway, De Ley-Doudoroff (DLD) pathway, was successfully integrated into M. thermophila, and the consumption rate of galactose in the engineered strain was increased by 57%. Our study focuses on metabolic engineering for accelerating galactose utilization in a thermophilic fungus that will be beneficial for the ratiol design of fungal strains to produce biofuels and biochemicals from a variety of feedstocks with abundant galactose.	Myceliophthora, galactose transport, galactose utilization, metabolic engineering, transcriptomic profiles	Frontiers in microbiology	College of Biotechnology, Tianjin University of Science and Technology, Tianjin, China.	China	2021	10.3389/fmicb.2021.664011
34513809	Improved Production of Xylase in Pichia pastoris and Its Application in Xylose Production From Xylan	Xylases with high specific activity has been focused with great interest as a useful enzyme in biomass utilization. The production of recombint GH11 xylase (MYCTH_56237) from Myceliophthora thermophila has been improved through N-termil sigl peptide engineering in P. pastoris. The production of newly recombint xylase (termed Mtxyn11C) was improved from 442.53 to 490.7 U/mL, through a replacement of alpha-factor sigl peptide with the tive xylase sigl peptide segment (MVSVKAVLLLGAAGTTLA) in P. pastoris. Scaling up of Mtxyn11C production in a 7.5 L fermentor was improved to the maximal production rate of 2503 U/mL. In this study, the degradation efficiency of Mtxyn11C was further examined. Alysis of the hydrolytic mode of action towards the birchwood xylan (BWX) revealed that Mtxyn11C was clearly more effective than commercial xylase and degrades xylan into xylooligosaccharides (xylobiose, xylotriose, xylotetraose). More importantly, Mtxyn11C in combition with a single multifunctiol xylanolytic enzyme, improved the hydrolysis of BWX into single xylose by 40%. Altogether, this study provided strategies for improved production of xylase together with rapid conversion of xylose from BWX, which provides sustaible, cost-effective and environmental friendly approaches to produce xylose/XOSs for biomass energy or biofuels production.	Myceliophthora thermophila, Pichia pastoris, hydrolytic activity, improved production, xylan, xylase, xylose	Frontiers in bioengineering and biotechnology	State Key Laboratory of Agro-Biotechnology, College of Biological Sciences, China Agricultural University, Beijing, China.	China	2021	10.3389/fbioe.2021.690702
35127677	Designing and Constructing a Novel Artificial Pathway for Malonic Acid Production Biologically	Malonic acid is used as a common component of many products and processes in the pharmaceutical and cosmetic industries. Here, we designed a novel artificial synthetic pathway of malonic acid, in which oxaloacetate, an intermediate of cytoplasmic reductive tricarboxylic acid (rTCA) pathway, is converted to malonic semialdehyde and then to malonic acid, sequentially catalyzed by a-keto decarboxylase and malonic semialdehyde dehydrogese. After the systematic screening, we discovered the enzyme oxaloacetate decarboxylase Mdc, catalyzing the first step of the artificially designed pathway in vitro. Then, this synthetic pathway was functiolly constructed in cellulolytic thermophilic fungus Myceliophthora thermophila. After enhancement of glucose uptake, the titer of malonic acid achieved 42.5 mg/L. This study presents a novel biological pathway for producing malonic acid from renewable resources in the future.	Myceliophthora thermophila, a-keto decarboxylase, malonic acid, metabolic engineering, oxaloacetic acid	Frontiers in bioengineering and biotechnology	Key Laboratory of Systems Microbial Biotechnology, Tianjin Institute of Industrial Biotechnology, Chinese Academy of Sciences, Tianjin, China.	China	2021	10.3389/fbioe.2021.820507
34556173	Coordition of consolidated bioprocessing technology and carbon dioxide fixation to produce malic acid directly from plant biomass in Myceliophthora thermophila	BACKGROUND: Consolidated bioprocessing (CBP) technique is a promising strategy for biorefinery construction, producing bulk chemicals directly from plant biomass without extra hydrolysis steps. Fixing and channeling CO(2) into carbon metabolism for increased carbon efficiency in producing value-added compounds is another strategy for cost-effective bio-manufacturing. It has not been reported whether these two strategies can be combined in one microbial platform. RESULTS: In this study, using the cellulolytic thermophilic fungus Myceliophthora thermophila, we designed and constructed a novel biorefinery system DMCC (Direct microbial conversion of biomass with CO(2) fixation) through incorporating two CO(2) fixation modules, PYC module and Calvin-Benson-Bassham (CBB) pathway. Harboring the both modules, the average rate of fixing and channeling (13)CO(2) into malic acid in strain CP51 achieved 44.4, 90.7, and 80.7 mg/L/h, on xylose, glucose, and cellulose, respectively. The corresponding titers of malic acid were up to 42.1, 70.4, and 70.1 g/L, respectively, representing the increases of 40%, 10%, and 7%, respectively, compared to the parental strain possessing only PYC module. The DMCC system was further improved by enhancing the pentose uptake ability. Using raw plant biomass as the feedstock, yield of malic acid produced by the DMCC system was up to 0.53 g/g, with (13)C content of 0.44 mol/mol malic acid, suggesting DMCC system can produce 1 t of malic acid from 1.89 t of biomass and fix 0.14 t CO(2) accordingly. CONCLUSIONS: This study designed and constructed a novel biorefinery system med DMCC, which can convert raw plant biomass and CO(2) into organic acid efficiently, presenting a promising strategy for cost-effective production of value-added compounds in biorefinery. The DMCC system is one of great options for realization of carbon neutral economy.	CBB cycle, CO2-fixation, Malic acid, Metabolic engineering, Myceliophthora, Plant biomass	Biotechnology for biofuels	Key Laboratory of Systems Microbial Biotechnology, Tianjin Institute of Industrial Biotechnology, Chinese Academy of Sciences, Tianjin, 300308, China.	China	2021	10.1186/s13068-021-02042-5
32640074	Growth kinetics of Myceliophthora thermophila M.7.7 in solid-state cultivation	AIMS: This work aimed to estimate the growth of Myceliophthora thermophila M.7.7 in solid-state cultivation (SSC) through quantification of N-acetyl-d-glucosamine (G) and enzyme activity. METHODS AND RESULTS: The fungus was cultivated in sugarcane bagasse and wheat bran. A consistent statistical alysis was done to assess the reliability of experimental data. Logistic model equation was fitted to experimental data and growth parameters were estimated. The results showed strong influence of the sample size on G and a minimum recommended sample size was identified. Scanning electron microscopy (SEM) was used to identify the strategy of substrate colonization. Wheat bran was attacked firstly, while sugarcane bagasse was consumed after wheat bran depletion. The biomass growth was poorly estimated by secretion kinetics of alpha-amylase, endoglucase, protease and xylase, but enzyme kinetics were important for understanding substrate colonization. CONCLUSIONS: In conclusion, the G concentration was strongly affected by the sample size and sampling procedure. The strategy of fungal colonization on the substrates was well characterized through SEM alysis. The colonization strategy has direct influence on the kinetic parameters of the logistic model. Myceliophthora thermophila has a well-defined dymic of enzyme secretion to degrade the substrate, although the kinetics of enzyme secretion has shown not adequate to characterize the kinetics of fungal growth. SIGNIFICANCE AND IMPACT OF THE STUDY: The paper provides reliable growth kinetic parameters in the SSC of the cellulase producer fungus M. thermophila M.7.7, as well as a robust alysis on three indirect methods (G, enzymes and SEM) for estimation of fungal development.	N-acetylglucosamine, enzymes, growth kinetics, logistic model, solid-state cultivation	Journal of applied microbiology	Instituto de Biociencias, Letras e Ciencias Exatas, Universidade Estadual Paulista (UNESP), Rua Cristovao Colombo 2265, Sao Jose do Rio Preto Sao Paulo, Brazil.	Brazil	2021	10.1111/jam.14774
33807631	Prospection of Fungal Lignocellulolytic Enzymes Produced from Jatoba (Hymeea courbaril) and Tamarind (Tamarindus indica) Seeds: Scaling for Bioreactor and Saccharification Profile of Sugarcane Bagasse	The lignocellulosic biomass comprises three main components: cellulose, hemicellulose, and lignin. Degradation and conversion of these three components are attractive to biotechnology. This study aimed to prospect fungal lignocellulolytic enzymes with potential industrial applications, produced through a temporal alysis using Hymeea courbaril and Tamarindus indica seeds as carbon sources. alpha-L-arabinofuranosidase, acetyl xylan esterase, endo-1,5-alpha-L-arabise, beta-D-galactosidase, beta-D-glucosidase, beta-glucase, beta-D-xylosidase, cellobiohydrolase, endoglucase, lichese, manse, polygalacturose, endo-1,4-beta-xylase, and xyloglucase activities were determined. The enzymes were produced for eight filamentous fungi: Aspergillus fumigatus, Trametes hirsuta, Lasiodiplodia sp., two strains of Trichoderma longibrachiatum, Neocosmospora perseae, FUSArium sp. and Thermothelomyces thermophilus. The best producers concerning enzymatic activity were T. thermophilus and T. longibrachiatum. The optimal conditions for enzyme production were the media supplemented with tamarind seeds, under agitation, for 72 h. This alysis was essential to demonstrate that cultivation conditions, static and under agitation, exert strong influences on the production of several enzymes produced by different fungi. The kind of sugarcane, pretreatment used, microorganisms, and carbon sources proved limiting sugar profile factors.	Hymeea courbaril, Tamarindus indica, bioprospecting, enzymes, lignocellulosic biomass	Microorganisms	Departamento de Bioquimica e Imunologia, Faculdade de Medicina de Ribeirao Preto, Universidade de Sao Paulo, Ribeirao Preto 14049-900, Brazil.	Brazil	2021	10.3390/microorganisms9030533
